{
  "schema_version": 1,
  "estimate_id": "walteur-build-a-support-risk-command-center-that-helps-s-20260624095838-estimate",
  "goal": "Build a support risk command center that helps support leads spot aging, blocked, and SLA-near tickets from seeded data",
  "phase": "intake",
  "minutes": {
    "best": 0,
    "expected": 0,
    "worst": 0
  },
  "tokens": {
    "best": 0,
    "expected": 0,
    "worst": 0,
    "input": 0,
    "output": 0
  },
  "usd": {
    "best": 0,
    "expected": 0,
    "worst": 0
  },
  "assumptions": [
    "Initial intake estimate. Replace expected values before plan or build work starts."
  ],
  "created_at": "2026-06-24T09:58:38Z"
}
